{
  "distribution": "full",
  "features": [
    "public-version-policy",
    "classify-prepare-verify",
    "multi-train-receipts",
    "guidance-update-notices"
  ],
  "guidanceVersion": 23,
  "provider": "simple-changelogs",
  "receiptVersions": [1, 2, 3],
  "requestVersions": [1, 2],
  "schemaDigests": {
    "changelogReceipt": "7d3b3734b5831aba1fb8e578a291b998777f59108448e1c57541bfb6d090a29e",
    "changelogRequest": "b5bbccd66631ead9029834a675ed2144de895b1ee3ef50abedfa424650b0e7e5"
  },
  "schemaVersion": 1
}
