{
  "distribution": "mobile",
  "features": [
    "public-version-policy",
    "classify-prepare-verify",
    "multi-train-receipts",
    "guidance-update-notices"
  ],
  "guidanceVersion": 20,
  "provider": "simple-changelogs",
  "receiptVersions": [1, 2],
  "requestVersions": [1],
  "schemaDigests": {
    "changelogReceipt": "7abe2ca338d12ca88c2dad03e904fa451dc6424fda9497bb4331845431416f93",
    "changelogRequest": "b5bbccd66631ead9029834a675ed2144de895b1ee3ef50abedfa424650b0e7e5"
  },
  "schemaVersion": 1
}
